{
  "schema_version": 1,
  "dataset_id": "source-to-intent-vertical-reviewed-v1",
  "owner": "SPEC-TO-INTENT-ALIGNMENT.4b",
  "selection_boundary_commit": "a3e9757d63ca5499a2393864fb503d6537de0035",
  "selection_claim": "Retrospective corpus baseline frozen before gold construction and held out from extractor changes at or after the selection boundary; it is not claimed historically untouched.",
  "minimum_documents_per_category": 2,
  "documents": [
    {
      "document_key": "ihi0024_e_2023_02_amba_5_apb_protocol_specification",
      "category": "wire-protocol",
      "source": {
        "location": "repository",
        "relative_path": "corpus/arm/amba/core/apb/current/IHI0024_E_2023-02_AMBA_5_APB_Protocol_Specification.pdf",
        "sha256": "c1e0fbc73d7bc61f1fdb63de75e78607ea989c1bffc8da0476bca3a84e40f204"
      },
      "review_scope_complete": true,
      "present_modalities": [
        "prose"
      ],
      "stages": {
        "source_ir": {
          "original_sha256": "0eb30dfe48d44f3ca6e2e5d945717c706673276c4ffadfe42715120126009fc3",
          "snapshot": {
            "snapshot_format": "reviewed_bounded_projection_v1",
            "regions": [
              {
                "region_id": "elem_00205",
                "modality": "prose",
                "source_excerpt": "The Setup phase of the write transfer occurs at T1 in Figure 3-1. The select signal, PSEL , is asserted, which means that PADDR , PWRITE , and PWDATA must be valid.",
                "reviewed_source_facts": [
                  "PADDR|must_be_value|VALID",
                  "PSEL|must_be_asserted|<missing>",
                  "PWDATA|must_be_value|VALID",
                  "PWRITE|must_be_value|VALID"
                ]
              }
            ]
          }
        },
        "evidence_ir": {
          "original_sha256": "0fe31edf71f9c51f7122ab3b1967f564af592c50438103ac702fee5d570b7cc1",
          "snapshot": {
            "snapshot_format": "reviewed_bounded_projection_v1",
            "captures": [
              {
                "region_id": "elem_00205",
                "family": "setup_signal_state",
                "capture_key": "setup_signal_state",
                "source_ids": [
                  "statement_0203"
                ]
              }
            ],
            "canonical": [
              {
                "region_id": "elem_00205",
                "family": "setup_signal_state",
                "fact_key": "PADDR|must_be_value|VALID",
                "source_ids": [
                  "statement_0203"
                ]
              },
              {
                "region_id": "elem_00205",
                "family": "setup_signal_state",
                "fact_key": "PWDATA|must_be_value|VALID",
                "source_ids": [
                  "statement_0203"
                ]
              },
              {
                "region_id": "elem_00205",
                "family": "setup_signal_state",
                "fact_key": "PWRITE|must_be_value|VALID",
                "source_ids": [
                  "statement_0203"
                ]
              }
            ],
            "residuals": []
          }
        },
        "semantic_ir": {
          "original_sha256": "33eb31ba9ce43319e87178ac5bc7920ea0a806a8ec2b6e7186df55cb5268142e",
          "snapshot": {
            "snapshot_format": "reviewed_bounded_projection_v1",
            "canonical": [
              {
                "region_id": "elem_00205",
                "family": "setup_signal_state",
                "fact_key": "PADDR|must_be_value|VALID",
                "source_ids": [
                  "statement_0203"
                ]
              },
              {
                "region_id": "elem_00205",
                "family": "setup_signal_state",
                "fact_key": "PWDATA|must_be_value|VALID",
                "source_ids": [
                  "statement_0203"
                ]
              },
              {
                "region_id": "elem_00205",
                "family": "setup_signal_state",
                "fact_key": "PWRITE|must_be_value|VALID",
                "source_ids": [
                  "statement_0203"
                ]
              }
            ],
            "residuals": []
          }
        },
        "intent_ir": {
          "original_sha256": "f044ec43a9fe2bcc13891e7d965791d077df56babbc250f01d5bc7e958f215f1",
          "snapshot": {
            "snapshot_format": "reviewed_bounded_projection_v1",
            "canonical": [
              {
                "region_id": "elem_00205",
                "family": "setup_signal_state",
                "fact_key": "PADDR|must_be_value|VALID",
                "source_ids": [
                  "statement_0203"
                ]
              },
              {
                "region_id": "elem_00205",
                "family": "setup_signal_state",
                "fact_key": "PWDATA|must_be_value|VALID",
                "source_ids": [
                  "statement_0203"
                ]
              },
              {
                "region_id": "elem_00205",
                "family": "setup_signal_state",
                "fact_key": "PWRITE|must_be_value|VALID",
                "source_ids": [
                  "statement_0203"
                ]
              }
            ],
            "residuals": []
          }
        }
      },
      "cells": [
        {
          "cell_id": "ihi0024_e_2023_02_amba_5_apb_protocol_specification__01_setup_signal_state",
          "semantic_family": "setup_signal_state",
          "modality": "prose",
          "oracle": "The prose states PSEL asserted and PADDR/PWRITE/PWDATA valid at setup T1.",
          "review_scope": "Complete review of SourceIR elem_00205 and its four explicit signal-state obligations.",
          "complete_gold": true,
          "expected_disposition": "canonical",
          "source_region": {
            "collection_pointer": "/regions",
            "predicates": [
              {
                "operator": "equals",
                "field": "/region_id",
                "value": "elem_00205"
              }
            ],
            "key_fields": [
              "/region_id"
            ],
            "expected_keys": [
              "elem_00205"
            ]
          },
          "evidence_capture": {
            "collection_pointer": "/captures",
            "predicates": [
              {
                "operator": "equals",
                "field": "/region_id",
                "value": "elem_00205"
              },
              {
                "operator": "equals",
                "field": "/family",
                "value": "setup_signal_state"
              }
            ],
            "key_fields": [
              "/capture_key"
            ],
            "expected_keys": [
              "setup_signal_state"
            ]
          },
          "canonical": {
            "evidence_ir": {
              "collection_pointer": "/canonical",
              "predicates": [
                {
                  "operator": "equals",
                  "field": "/region_id",
                  "value": "elem_00205"
                },
                {
                  "operator": "equals",
                  "field": "/family",
                  "value": "setup_signal_state"
                }
              ],
              "key_fields": [
                "/fact_key"
              ],
              "expected_keys": [
                "PADDR|must_be_value|VALID",
                "PSEL|must_be_asserted|<missing>",
                "PWDATA|must_be_value|VALID",
                "PWRITE|must_be_value|VALID"
              ],
              "provenance_fields": [
                "/source_ids"
              ],
              "required_provenance_ids": [
                "statement_0203"
              ]
            },
            "semantic_ir": {
              "collection_pointer": "/canonical",
              "predicates": [
                {
                  "operator": "equals",
                  "field": "/region_id",
                  "value": "elem_00205"
                },
                {
                  "operator": "equals",
                  "field": "/family",
                  "value": "setup_signal_state"
                }
              ],
              "key_fields": [
                "/fact_key"
              ],
              "expected_keys": [
                "PADDR|must_be_value|VALID",
                "PSEL|must_be_asserted|<missing>",
                "PWDATA|must_be_value|VALID",
                "PWRITE|must_be_value|VALID"
              ],
              "provenance_fields": [
                "/source_ids"
              ],
              "required_provenance_ids": [
                "statement_0203"
              ]
            },
            "intent_ir": {
              "collection_pointer": "/canonical",
              "predicates": [
                {
                  "operator": "equals",
                  "field": "/region_id",
                  "value": "elem_00205"
                },
                {
                  "operator": "equals",
                  "field": "/family",
                  "value": "setup_signal_state"
                }
              ],
              "key_fields": [
                "/fact_key"
              ],
              "expected_keys": [
                "PADDR|must_be_value|VALID",
                "PSEL|must_be_asserted|<missing>",
                "PWDATA|must_be_value|VALID",
                "PWRITE|must_be_value|VALID"
              ],
              "provenance_fields": [
                "/source_ids"
              ],
              "required_provenance_ids": [
                "statement_0203"
              ]
            }
          },
          "residual": {
            "semantic_ir": {
              "collection_pointer": "/residuals",
              "predicates": [
                {
                  "operator": "equals",